Georgia,atlanta,nat,apa,6968083472,None,Try before you buy! Rent any house that's for sale!,https://atlanta.craigslist.org/nat/apa/d/marietta-try-before-you-buy-rent-any/6968083472.html,2019-09-26,19:26,$1500,Marietta,True,None,4,None
Georgia,atlanta,nat,apa,6968082885,None,Rent any house that's for sale in Marietta!,https://atlanta.craigslist.org/nat/apa/d/marietta-rent-any-house-thats-for-sale/6968082885.html,2019-09-26,19:26,$1500,Marietta,True,None,4,None
Georgia,atlanta,nat,apa,6968082200,None,Looking to move this Fall? Choose your house NOW!,https://atlanta.craigslist.org/nat/apa/d/marietta-looking-to-move-this-fall/6968082200.html,2019-09-26,19:26,$1500,Marietta,True,None,4,None
Georgia,atlanta,nat,apa,6987347002,5986231132,Basement Apartment / Private Mini Horse Farm,https://atlanta.craigslist.org/nat/apa/d/roswell-basement-apartment-private-mini/6987347002.html,2019-09-26,19:26,$1200,Woodstock,True,None,1,None
Georgia,atlanta,nat,apa,6985797292,None,"֍ Marietta apartment for rent, Children's Play Area, Sparkling Pool",https://atlanta.craigslist.org/nat/apa/d/marietta-marietta-apartment-for-rent/6985797292.html,2019-09-26,18:38,$1285,None,True,None,1,775ft2
Georgia,atlanta,nat,apa,6987304865,None,Close to everything! Meticulously kept propriety,https://atlanta.craigslist.org/nat/apa/d/atlanta-close-to-everything/6987304865.html,2019-09-26,18:32,$1125,Sandy Springs,True,None,1,895ft2
Georgia,atlanta,nat,apa,6980040447,None,$500 Off First Months Rent on Renovated Apartment Home!,https://atlanta.craigslist.org/nat/apa/d/marietta-500-off-first-months-rent-on/6980040447.html,2019-09-26,18:22,$1400,Marietta,True,None,2,1340ft2
Georgia,atlanta,nat,apa,6987302656,None,"Come, see, love, rent today for special savings!",https://atlanta.craigslist.org/nat/apa/d/atlanta-come-see-love-rent-today-for/6987302656.html,2019-09-26,18:21,$1300,Sandy Springs,True,None,2,1370ft2
Georgia,atlanta,nat,apa,6987305147,None,Brookwood high district home in snellville,https://atlanta.craigslist.org/nat/apa/d/snellville-brookwood-high-district-home/6987305147.html,2019-09-26,18:20,$0,None,True,None,None,None
Georgia,atlanta,nat,apa,6987301694,None,"Stylish Features, Tennis Court, BBQ Picnic Area",https://atlanta.craigslist.org/nat/apa/d/norcross-stylish-features-tennis-court/6987301694.html,2019-09-26,18:15,$1461,Norcross,True,None,3,1533ft2
Georgia,atlanta,nat,apa,6987301134,None,"Convenient Location, Washer Dryer Connections, Vaulted Ceilings",https://atlanta.craigslist.org/nat/apa/d/norcross-convenient-location-washer/6987301134.html,2019-09-26,18:14,$1037,Norcross,True,None,2,1048ft2
Georgia,atlanta,nat,apa,6987300772,None,One month FREE rent on select apartments! Very few left!!,https://atlanta.craigslist.org/nat/apa/d/atlanta-one-month-free-rent-on-select/6987300772.html,2019-09-26,18:13,$1350,Sandy Springs,True,None,2,1285ft2
Georgia,atlanta,nat,apa,6987297810,None,Plenty Of Living Space To Entertain Your Guests! 3 Bedroom Apt Home!,https://atlanta.craigslist.org/nat/apa/d/covington-plenty-of-living-space-to/6987297810.html,2019-09-26,18:09,$1141,Wellington  Ridge,False,None,3,1353ft2
Georgia,atlanta,nat,apa,6987290086,None,DON'T WAIT!! $500 OFF 1ST MONTH ON SELECT UNITS!! DON'T MISS OUT,https://atlanta.craigslist.org/nat/apa/d/smyrna-dont-wait-500-off-1st-month-on/6987290086.html,2019-09-26,18:08,$1455,Smyrna,True,None,2,1224ft2
Georgia,atlanta,nat,apa,6979857204,None,"☆ Marietta Apartment Homes, Children's Play Area, Hardwood Floors",https://atlanta.craigslist.org/nat/apa/d/marietta-marietta-apartment-homes/6979857204.html,2019-09-26,18:08,$1230,None,True,None,1,775ft2
Georgia,atlanta,nat,apa,6987287190,None,$500 OFF FIRST MONTH!!!!!!! ACT FAST THESE SPECIALS WON'T LAST!!,https://atlanta.craigslist.org/nat/apa/d/smyrna-500-off-first-month-act-fast/6987287190.html,2019-09-26,18:06,$1360,Smyrna,True,None,2,1182ft2
Georgia,atlanta,nat,apa,6987294204,None,2 bed 2 bath ~ $300 OFF MOVE IN SPECIAL ~ $99 APP. & ADM. FEE !!,https://atlanta.craigslist.org/nat/apa/d/peachtree-corners-2-bed-2-bath-300-off/6987294204.html,2019-09-26,18:04,$1300,"6516 Spalding Dr. Peachtree Corners, GA",True,None,2,1276ft2
Georgia,atlanta,nat,apa,6977661511,None,Amazing 2 bedroom! Lease and Move in Today!,https://atlanta.craigslist.org/nat/apa/d/alpharetta-amazing-2-bedroom-lease-and/6977661511.html,2019-09-26,18:03,$1375,None,True,None,2,1186ft2
Georgia,atlanta,nat,apa,6969281221,6380354835,Open kitchen and dining room.Total electric.Las Palmas apartments,https://atlanta.craigslist.org/nat/apa/d/atlanta-open-kitchen-and-dining/6969281221.html,2019-09-26,18:03,$1550,Norcross,True,None,3,1515ft2
Georgia,atlanta,nat,apa,6968828951,6387838610,"Low credit? 2 Bedroom, 2 Bathroom Apartment AVAILABLE!!",https://atlanta.craigslist.org/nat/apa/d/atlanta-low-credit-2-bedroom-2-bathroom/6968828951.html,2019-09-26,18:03,$1391,Norcross,True,None,2,1437ft2
Georgia,atlanta,nat,apa,6976625257,6380354835,New Building Near Buckhead and Atlanta Area!!,https://atlanta.craigslist.org/nat/apa/d/atlanta-new-building-near-buckhead-and/6976625257.html,2019-09-26,18:02,$1386,Norcross,True,None,2,1143ft2
Georgia,atlanta,nat,apa,6987292260,None,"WARM UP with Fall Deals in Roswell, GA at Aspen Pointe",https://atlanta.craigslist.org/nat/apa/d/roswell-warm-up-with-fall-deals-in/6987292260.html,2019-09-26,18:01,$1075,"Roswell, GA",True,None,2,1365ft2
Georgia,atlanta,nat,apa,6987291392,None,$500 OFF! $500 OFF! $500 OFF! $500 OFF!!! DON'T MISS OUT!!,https://atlanta.craigslist.org/nat/apa/d/smyrna-500-off-500-off-500-off-500-off/6987291392.html,2019-09-26,18:00,$1470,Smyrna,True,None,2,1224ft2
Georgia,atlanta,nat,apa,6987291083,None,"Stylish Features, Walk In Closets, Tennis and Sport Courts",https://atlanta.craigslist.org/nat/apa/d/atlanta-stylish-features-walk-in/6987291083.html,2019-09-26,17:59,$1265,Peachtree Corners,True,None,3,1175ft2
Georgia,atlanta,nat,apa,6987288891,None,$500 OFF THE FIRST MONTH!!! ACT FAST!!!! WON'T LAST LONG,https://atlanta.craigslist.org/nat/apa/d/smyrna-500-off-the-first-month-act-fast/6987288891.html,2019-09-26,17:56,$1465,Smyrna,True,None,2,1302ft2
Georgia,atlanta,nat,apa,6985828197,None,"☆ Apartments in DUNWOODY, Media Room, Walk-In Closet",https://atlanta.craigslist.org/nat/apa/d/atlanta-apartments-in-dunwoody-media/6985828197.html,2019-09-26,17:55,$1190,"DUNWOODY, SANDY SPRINGS, PERIMETER, ROSWELL, ATLANTA",True,None,1,616ft2
Georgia,atlanta,nat,apa,6982343882,None,"Business Center, Grill Areas Near Pool & Courtyard, YMCA Club Discount",https://atlanta.craigslist.org/nat/apa/d/atlanta-business-center-grill-areas/6982343882.html,2019-09-26,17:47,$1789,None,True,None,2,1203ft2
Georgia,atlanta,nat,apa,6987276307,None,"Resident business center with private resident offices, Dog run",https://atlanta.craigslist.org/nat/apa/d/atlanta-resident-business-center-with/6987276307.html,2019-09-26,17:46,$1470,Sandy Springs,True,None,1,708ft2
Georgia,atlanta,nat,apa,6987280645,None,"Outdoor Kitchen & Gas Grills at Pool, Storage Units, WiFi Lounge",https://atlanta.craigslist.org/nat/apa/d/atlanta-outdoor-kitchen-gas-grills-at/6987280645.html,2019-09-26,17:45,$1455,None,True,None,1,830ft2
Georgia,atlanta,nat,apa,6987279480,None,Less than a half mile west of the Executive Park shuttle,https://atlanta.craigslist.org/nat/apa/d/atlanta-less-than-half-mile-west-of-the/6987279480.html,2019-09-26,17:43,$1115,None,True,None,1,550ft2
Georgia,atlanta,nat,apa,6987277260,None,"On-Site Management, Swimming Pool, High-Speed Internet Available",https://atlanta.craigslist.org/nat/apa/d/atlanta-on-site-management-swimming/6987277260.html,2019-09-26,17:40,$1798,None,True,None,2,1203ft2
Georgia,atlanta,nat,apa,6987276599,None,"Outdoor Kitchen & Gas Grills at Pool, YMCA Club Discount, Picnic Areas",https://atlanta.craigslist.org/nat/apa/d/atlanta-outdoor-kitchen-gas-grills-at/6987276599.html,2019-09-26,17:39,$1799,None,True,None,2,1203ft2
Georgia,atlanta,nat,apa,6987275809,None,"Swimming Pool, On-Site Management, WiFi Lounge",https://atlanta.craigslist.org/nat/apa/d/atlanta-swimming-pool-on-site/6987275809.html,2019-09-26,17:38,$1800,None,True,None,2,1203ft2
Georgia,atlanta,nat,apa,6980511270,None,**2brs start $1480! 3brs start $1636!**$250off** Incl. Garages,https://atlanta.craigslist.org/nat/apa/d/hiram-2brs-start-brs-start-off-incl/6980511270.html,2019-09-26,17:37,$1636,Hiram/You'll LOVE Hiram! COTTAGES AT GREYSTONE TOWHOMES!,True,None,3,None
Georgia,atlanta,nat,apa,6980506073,None,"Perfectly Priced, Phenomenal Designer TOWNHOMES w/garage!",https://atlanta.craigslist.org/nat/apa/d/dawsonville-perfectly-priced-phenomenal/6980506073.html,2019-09-26,17:37,$1595,DAWSONVILLE-Brand NEW! 3brs $1595+ /COTTAGES AT RILEY PLACE,True,None,3,None
Georgia,atlanta,nat,apa,6985805071,None,"Spacious Living Room, Wooded Views, 3 Lighted Tennis Courts",https://atlanta.craigslist.org/nat/apa/d/kennesaw-spacious-living-room-wooded/6985805071.html,2019-09-26,17:32,$1481,None,True,None,2,1283ft2
Georgia,atlanta,nat,apa,6982638001,None,"SPACIOUS UNITS, BRAND NEW APPLIANCES, RENOVATED GYM! VISIT TODAY!",https://atlanta.craigslist.org/nat/apa/d/marietta-spacious-units-brand-new/6982638001.html,2019-09-26,17:32,$1659,None,True,None,2,1227ft2
Georgia,atlanta,nat,apa,6987270899,None,"NEWLY UPGRADED APARTMENTS, UNIQUE FLOOR PLANS AVAILBLE!",https://atlanta.craigslist.org/nat/apa/d/roswell-newly-upgraded-apartments/6987270899.html,2019-09-26,17:31,$1205,WOOD CREEK,True,None,2,1190ft2
Georgia,atlanta,nat,apa,6985802710,None,"Leash-Free Fenced-in Bark Park, Private Patios & Balconies, En Suites",https://atlanta.craigslist.org/nat/apa/d/marietta-leash-free-fenced-in-bark-park/6985802710.html,2019-09-26,17:26,$1400,Marietta,True,None,3,1550ft2
Georgia,atlanta,nat,apa,6985779440,None,"☀ Apartments available in DUNWOODY, Elevator, Clubhouse",https://atlanta.craigslist.org/nat/apa/d/atlanta-apartments-available-in/6985779440.html,2019-09-26,17:24,$1519,"DUNWOODY, SANDY SPRINGS, PERIMETER, ROSWELL, ATLANTA",True,None,2,1089ft2
Georgia,atlanta,nat,apa,6981980721,None,"PARK CREEK! Brilliantly, inspired, luxury-focused floorplans-$500off!",https://atlanta.craigslist.org/nat/apa/d/gainesville-park-creek-brilliantly/6981980721.html,2019-09-26,17:21,$0,Gainesville/**PARK CREEK- Super fantastic floorplans & $500o,True,None,None,None
Georgia,atlanta,nat,apa,6987262671,None,"Granite Countertops, TV Lounge, Custom Cabinetry",https://atlanta.craigslist.org/nat/apa/d/buford-granite-countertops-tv-lounge/6987262671.html,2019-09-26,17:20,$1656,None,True,None,3,1549ft2
Georgia,atlanta,nat,apa,6975288899,None,"2, 3 and 4 bedroom BRAND NEW TOWNHOMES w/Garages!Only the BEST will do",https://atlanta.craigslist.org/nat/apa/d/dawsonville-2-3-and-4-bedroom-brand-new/6975288899.html,2019-09-26,17:20,$1595,DAWSONVILLE-*Phenomenal living-COTTAGES AT RILEY PLACE,True,None,3,None
Georgia,atlanta,nat,apa,6980520758,None,"TV Lounge, Resort Style Swimming Pool, Garden Bathtub",https://atlanta.craigslist.org/nat/apa/d/buford-tv-lounge-resort-style-swimming/6980520758.html,2019-09-26,17:20,$1393,None,True,None,2,1373ft2
Georgia,atlanta,nat,apa,6980054662,None,"Doubled Sided Fireplaces, custom accent colors, CrownMolding & More!",https://atlanta.craigslist.org/nat/apa/d/decatur-doubled-sided-fireplaces-custom/6980054662.html,2019-09-26,17:19,$1414,*Decatur Flats-Renovated 2brs start $1414+/ 1brs $1245+,True,None,2,None
Georgia,atlanta,nat,apa,6987257816,None,"Outdoor Jacuzzi, Brushed Nickel Light Fixtures, Private Patio Storage",https://atlanta.craigslist.org/nat/apa/d/peachtree-corners-outdoor-jacuzzi/6987257816.html,2019-09-26,17:14,$1046,None,True,None,1,900ft2
Georgia,atlanta,nat,apa,6987257146,None,"Sports Court, Plank Flooring, Clubhouse with Executive Business Center",https://atlanta.craigslist.org/nat/apa/d/peachtree-corners-sports-court-plank/6987257146.html,2019-09-26,17:13,$1033,None,True,None,1,800ft2
Georgia,atlanta,nat,apa,6987256901,None,"Great Location, Renovated units, Dog park , Play Ground",https://atlanta.craigslist.org/nat/apa/d/marietta-great-location-renovated-units/6987256901.html,2019-09-26,17:12,$1275,Marietta,True,None,3,1410ft2
Georgia,atlanta,nat,apa,6987256202,None,"Granite Countertops, High Speed Internet Access Available, Carwash",https://atlanta.craigslist.org/nat/apa/d/peachtree-corners-granite-countertops/6987256202.html,2019-09-26,17:12,$1097,None,True,None,1,1000ft2
Georgia,atlanta,nat,apa,6987254764,None,"Community Laundry Facility, Bark Park, Pet-Friendly Community",https://atlanta.craigslist.org/nat/apa/d/peachtree-corners-community-laundry/6987254764.html,2019-09-26,17:10,$1046,None,True,None,1,900ft2
Georgia,atlanta,nat,apa,6985524516,None,"Puppy Park, Luxurious En Suite, Expansive Closets",https://atlanta.craigslist.org/nat/apa/d/atlanta-puppy-park-luxurious-en-suite/6985524516.html,2019-09-26,17:10,$1155,Atlanta,True,None,2,1280ft2
Georgia,atlanta,nat,apa,6987254207,None,"Stainless Steel Appliances, Pet-Friendly Community, Microwave",https://atlanta.craigslist.org/nat/apa/d/peachtree-corners-stainless-steel/6987254207.html,2019-09-26,17:09,$1033,None,True,None,1,800ft2
Georgia,atlanta,nat,apa,6987253552,None,"Stainless Steel Appliances, Private Patio Storage, Plank Flooring",https://atlanta.craigslist.org/nat/apa/d/peachtree-corners-stainless-steel/6987253552.html,2019-09-26,17:08,$897,None,True,None,1,700ft2
Georgia,atlanta,nat,apa,6987250631,None,Monthly Special-Fully Furnished Room Available,https://atlanta.craigslist.org/nat/apa/d/roswell-monthly-special-fully-furnished/6987250631.html,2019-09-26,17:06,$850,ROSWELL,True,None,None,300ft2
Georgia,atlanta,nat,apa,6987247883,None,X marks the spot! You've just found a gorgeous 2 bed / 2 bath!,https://atlanta.craigslist.org/nat/apa/d/alpharetta-marks-the-spot-youve-just/6987247883.html,2019-09-26,17:01,$1490,Alpharetta,False,None,2,1191ft2
Georgia,atlanta,nat,apa,6982222962,None,Lease Purchase this Large Executive Home,https://atlanta.craigslist.org/nat/apa/d/alpharetta-lease-purchase-this-large/6982222962.html,2019-09-26,17:00,$2500,Milton,True,None,5,3485ft2
Georgia,atlanta,nat,apa,6987244972,None,"Let us show you the home of your dreams! Tour our 1 Bed, 1 bath!",https://atlanta.craigslist.org/nat/apa/d/roswell-let-us-show-you-the-home-of/6987244972.html,2019-09-26,16:57,$1210,North Point Mall,True,None,None,850ft2
Georgia,atlanta,nat,apa,6980641392,None,"☀ Apartments in Marietta, Ceiling Fans, Breakfast Bar",https://atlanta.craigslist.org/nat/apa/d/marietta-apartments-in-marietta-ceiling/6980641392.html,2019-09-26,16:54,$1994,None,True,None,3,1376ft2
Georgia,atlanta,nat,apa,6987241279,None,Are you a savvy shopper? Get the Most Apartment for Your Buck!,https://atlanta.craigslist.org/nat/apa/d/roswell-are-you-savvy-shopper-get-the/6987241279.html,2019-09-26,16:52,$1009,"Roswell, GA",True,None,2,1250ft2
Georgia,atlanta,nat,apa,6987241281,None,"Awesome Move In SPECIALS ,Call us TODAY and Find out how to save",https://atlanta.craigslist.org/nat/apa/d/duluth-awesome-move-in-specials-call-us/6987241281.html,2019-09-26,16:52,$1157,Duluth,True,None,2,1034ft2
Georgia,atlanta,nat,apa,6987232078,None,Check out these views! You'll love this location and this 1 bd 1 ba!,https://atlanta.craigslist.org/nat/apa/d/alpharetta-check-out-these-views-youll/6987232078.html,2019-09-26,16:41,$1120,None,False,None,None,None
Georgia,atlanta,nat,apa,6987230576,None,This Is How We Do It... Ashford Way Apartment Homes,https://atlanta.craigslist.org/nat/apa/d/lawrenceville-this-is-how-we-do-it/6987230576.html,2019-09-26,16:39,$925,Lawrenceville,True,None,1,720ft2
Georgia,atlanta,nat,apa,6987212874,None,"Luxurious En Suite, Spacious Bedrooms with Ceiling Fans, Puppy Park",https://atlanta.craigslist.org/nat/apa/d/atlanta-luxurious-en-suite-spacious/6987212874.html,2019-09-26,16:36,$1177,Atlanta,True,None,2,1280ft2
Georgia,atlanta,nat,apa,6966589016,6869434006,➽➽ BRAND NEW BUILDING ➽➽ Beautiful apartments in Norcross!,https://atlanta.craigslist.org/nat/apa/d/atlanta-brand-new-building-beautiful/6966589016.html,2019-09-26,16:32,$1391,Norcross,True,None,2,1437ft2
Georgia,atlanta,nat,apa,6987221855,None,Luxurious 2 bedroom with amazing amenities!!,https://atlanta.craigslist.org/nat/apa/d/atlanta-luxurious-2-bedroom-with/6987221855.html,2019-09-26,16:28,$1781,"550 Rock Springs Court Atlanta, GA",True,None,2,1383ft2
Georgia,atlanta,nat,apa,6982003271,None,"Puppy Park, Private Balconies, Large Living Rooms",https://atlanta.craigslist.org/nat/apa/d/atlanta-puppy-park-private-balconies/6982003271.html,2019-09-26,16:28,$1591,Atlanta,True,None,2,1360ft2
Georgia,atlanta,nat,apa,6987196874,None,Amazing 3br/2bath apartment near Rubes Creek Trail,https://atlanta.craigslist.org/nat/apa/d/lebanon-amazing-3br-2bath-apartment/6987196874.html,2019-09-26,16:26,$1076,Woodstock,True,None,None,1367ft2
Georgia,atlanta,nat,apa,6966041491,6878286864,"֍ $150 OFF!! Great location, pool, fitness center, W/D connections!",https://atlanta.craigslist.org/nat/apa/d/atlanta-150-off-great-location-pool/6966041491.html,2019-09-26,16:25,$1066,Norcross,True,None,2,1196ft2
Georgia,atlanta,nat,apa,6987216913,None,1 Bedroom in Buford,https://atlanta.craigslist.org/nat/apa/d/buford-1-bedroom-in-buford/6987216913.html,2019-09-26,16:22,$1055,None,False,None,1,792ft2
Georgia,atlanta,nat,apa,6966037083,6868793228,MOVE IN SPECIAL $150 off! Las Palmas Apartments in Norcross,https://atlanta.craigslist.org/nat/apa/d/atlanta-move-in-special-150-off-las/6966037083.html,2019-09-26,16:21,$1066,Norcross,True,None,2,1196ft2
Georgia,atlanta,nat,apa,6966045883,6879846967,Low credit?✨Amazing 2 bedroom 2 bathroom✨Hurry in today for a tour,https://atlanta.craigslist.org/nat/apa/d/atlanta-low-creditamazing-2-bedroom-2/6966045883.html,2019-09-26,16:21,$1061,Norcross,True,None,2,1143ft2
Georgia,atlanta,nat,apa,6966573584,6869376896,***Preferred Employer Discounts*** Las Palmas Apartments in Norcross,https://atlanta.craigslist.org/nat/apa/d/atlanta-preferred-employer-discounts/6966573584.html,2019-09-26,16:19,$1061,Norcross,True,None,2,1143ft2
Georgia,atlanta,nat,apa,6966583878,6878286864,"֍ 3x2 Great location, pool, fitness center, W/D connections!",https://atlanta.craigslist.org/nat/apa/d/atlanta-3x2-great-location-pool-fitness/6966583878.html,2019-09-26,16:17,$1310,Norcross,True,None,3,1300ft2
Georgia,atlanta,nat,apa,6987212519,None,Enjoy the comfort of your new Studio!,https://atlanta.craigslist.org/nat/apa/d/lebanon-enjoy-the-comfort-of-your-new/6987212519.html,2019-09-26,16:17,$813,Woodstock,False,None,None,288ft2
Georgia,atlanta,nat,apa,6987192924,None,"House for Rent 3BR 2BA 3272 Douglas Lane, Kennesaw, GA 30144",https://atlanta.craigslist.org/nat/apa/d/kennesaw-house-for-rent-3br-2ba-3272/6987192924.html,2019-09-26,16:16,$1500,Kennesaw - KSU,True,None,None,None
Georgia,atlanta,nat,apa,6987209320,None,"Pavilion, Carpets in bedrooms, Social lounge, ""Big Green Egg"" cooker",https://atlanta.craigslist.org/nat/apa/d/smyrna-pavilion-carpets-in-bedrooms/6987209320.html,2019-09-26,16:13,$1528,Smyrna,True,None,1,860ft2
Georgia,atlanta,nat,apa,6966048145,6869388075,"♥ Love your new home in Las Palmas apartments, Norcross♥",https://atlanta.craigslist.org/nat/apa/d/atlanta-love-your-new-home-in-las/6966048145.html,2019-09-26,16:13,$1036,Norcross,True,None,2,1143ft2
Georgia,atlanta,nat,apa,6966008939,None,"✔BRAND NEW BUILDING, huge rooms, private balconies, great price!",https://atlanta.craigslist.org/nat/apa/d/atlanta-brand-new-building-huge-rooms/6966008939.html,2019-09-26,16:12,$1390,Norcross,True,None,2,1195ft2
Georgia,atlanta,nat,apa,6966591854,6868793228,***Preferred Employer Discounts*** Las Palmas Apartments in Norcross,https://atlanta.craigslist.org/nat/apa/d/atlanta-preferred-employer-discounts/6966591854.html,2019-09-26,16:12,$1066,Norcross,True,None,2,1196ft2
Georgia,atlanta,nat,apa,6967492272,6879846967,Low credit?✨Amazing 2 bedroom 2 bathroom✨Hurry in today for a tour,https://atlanta.craigslist.org/nat/apa/d/atlanta-low-creditamazing-2-bedroom-2/6967492272.html,2019-09-26,16:12,$1056,Norcross,True,None,2,1275ft2
Georgia,atlanta,nat,apa,6985722182,None,"Picnic area with barbecue, Quiet lakefront setting, Pantry",https://atlanta.craigslist.org/nat/apa/d/roswell-picnic-area-with-barbecue-quiet/6985722182.html,2019-09-26,16:11,$1175,"Roswell,Alpharetta, Norcross, Sandy Springs,",True,None,2,None
Georgia,atlanta,nat,apa,6966000568,6868803660,➤Cozy BRAND NEW apartment in Las Palmas Apartments (new building!),https://atlanta.craigslist.org/nat/apa/d/atlanta-cozy-brand-new-apartment-in-las/6966000568.html,2019-09-26,16:09,$1390,Norcross,True,None,2,1195ft2
Georgia,atlanta,nat,apa,6987205588,None,"Social and networking events, Ample storage space, Vaulted Ceiling",https://atlanta.craigslist.org/nat/apa/d/atlanta-social-and-networking-events/6987205588.html,2019-09-26,16:09,$1155,None,True,None,1,750ft2
Georgia,atlanta,nat,apa,6987195737,None,"Call for Details, Cats and Dogs Welcome, Two Resort Style Pools",https://atlanta.craigslist.org/nat/apa/d/call-for-details-cats-and-dogs-welcome/6987195737.html,2019-09-26,16:09,$1390,Lawrenceville,True,None,2,1353ft2
Georgia,atlanta,nat,apa,6966004578,None,✔MOVE IN SPECIAL $150 OFF October's rent!! 2BR/2B,https://atlanta.craigslist.org/nat/apa/d/atlanta-move-in-special-150-off/6966004578.html,2019-09-26,16:07,$1066,Norcross,True,None,2,1196ft2
Georgia,atlanta,nat,apa,6966600568,6868765353,➽➽ BRAND NEW BUILDING ➽➽ Beautiful apartments in Norcross!,https://atlanta.craigslist.org/nat/apa/d/atlanta-brand-new-building-beautiful/6966600568.html,2019-09-26,16:07,$1390,Norcross,True,None,2,1437ft2
Georgia,atlanta,nat,apa,6966580037,6878289202,$150 OFF october's rent!! Beautiful 2BR/2B in Norcross,https://atlanta.craigslist.org/nat/apa/d/atlanta-150-off-octobers-rent-beautiful/6966580037.html,2019-09-26,16:05,$1061,Norcross,True,None,2,1143ft2
Georgia,atlanta,nat,apa,6966035136,6878293654,$150 OFF OCT's RENT🔹Total electric🔹Las Palmas apartments,https://atlanta.craigslist.org/nat/apa/d/atlanta-150-off-octs-renttotal/6966035136.html,2019-09-26,16:01,$1061,Norcross,True,None,2,1143ft2
Georgia,atlanta,nat,apa,6987198606,None,"Lease Today, Resort Style Pool, Contemporary Countertops",https://atlanta.craigslist.org/nat/apa/d/atlanta-lease-today-resort-style-pool/6987198606.html,2019-09-26,16:00,$1230,Sandy Springs,True,None,2,1209ft2
Georgia,atlanta,nat,apa,6987197726,None,"Professionally Managed, Business Center, Fitness Center",https://atlanta.craigslist.org/nat/apa/d/atlanta-professionally-managed-business/6987197726.html,2019-09-26,15:59,$1189,Norcross,True,None,1,820ft2
Georgia,atlanta,nat,apa,6966595179,6869459496,MOVE-IN SPECIAL🔹Total electric🔹Las Palmas apartments,https://atlanta.craigslist.org/nat/apa/d/atlanta-move-in-specialtotal/6966595179.html,2019-09-26,15:59,$1066,Norcross,True,None,2,1196ft2
Georgia,atlanta,nat,apa,6965992759,6869459496,Open kitchen and dining room🔹Total electric🔹Las Palmas apartments,https://atlanta.craigslist.org/nat/apa/d/atlanta-open-kitchen-and-dining/6965992759.html,2019-09-26,15:58,$1061,Norcross,True,None,2,1143ft2
Georgia,atlanta,nat,apa,6966043736,6868765353,"➤BRAND NEW BUILDING, huge rooms, private balconies, great price!",https://atlanta.craigslist.org/nat/apa/d/atlanta-brand-new-building-huge-rooms/6966043736.html,2019-09-26,15:53,$1391,Norcross,True,None,2,1437ft2
Georgia,atlanta,nat,apa,6970780666,None,SEPTEMBER LOOK + LEASE SPECIALS!,https://atlanta.craigslist.org/nat/apa/d/atlanta-september-look-lease-specials/6970780666.html,2019-09-26,15:52,$2550,"210 Peters St SW Atlanta, GA",False,None,2,1257ft2
Georgia,atlanta,nat,apa,6976941872,None,AT&T Employees: Ask about our preferred employer program!,https://atlanta.craigslist.org/nat/apa/d/atlanta-att-employees-ask-about-our/6976941872.html,2019-09-26,15:52,$2505,"210 Peters St SW Atlanta, GA",True,None,2,1394ft2
Georgia,atlanta,nat,apa,6976940612,None,Appointments Available! Call today for a tour!,https://atlanta.craigslist.org/nat/apa/d/atlanta-appointments-available-call/6976940612.html,2019-09-26,15:51,$1810,"210 Peters St SW Atlanta, GA",False,None,1,864ft2
Georgia,atlanta,nat,apa,6987191568,None,Fall in LOVE with 2800 at Sweetwater Apartments,https://atlanta.craigslist.org/nat/apa/d/lawrenceville-fall-in-love-with-2800-at/6987191568.html,2019-09-26,15:51,$1255,Lawrenceville,True,None,None,962ft2
Georgia,atlanta,nat,apa,6982152895,None,September Look & Lease Specials!,https://atlanta.craigslist.org/nat/apa/d/atlanta-september-look-lease-specials/6982152895.html,2019-09-26,15:51,$1605,"210 Peters St SW Atlanta, GA",False,None,1,742ft2
Georgia,atlanta,nat,apa,6976228503,None,$1000 GIFT CARD FOR SELECT MOVE INS!,https://atlanta.craigslist.org/nat/apa/d/atlanta-1000-gift-card-for-select-move/6976228503.html,2019-09-26,15:51,$2380,"210 Peters St SW Atlanta, GA",False,None,2,1265ft2
Georgia,atlanta,nat,apa,6975468216,None,MOVE-IN READY UNITS AVAILABLE!,https://atlanta.craigslist.org/nat/apa/d/atlanta-move-in-ready-units-available/6975468216.html,2019-09-26,15:51,$1460,"210 Peters St SW Atlanta, GA",True,None,1,673ft2
Georgia,atlanta,nat,apa,6975039613,None,LOOK + LEASE SPECIALS!,https://atlanta.craigslist.org/nat/apa/d/atlanta-look-lease-specials/6975039613.html,2019-09-26,15:51,$2195,"210 Peters St SW Atlanta, GA",True,None,2,1247ft2
Georgia,atlanta,nat,apa,6972075424,None,MINUTES AWAY FROM MERCEDES BENZ STADIUM!,https://atlanta.craigslist.org/nat/apa/d/atlanta-minutes-away-from-mercedes-benz/6972075424.html,2019-09-26,15:50,$2380,"210 Peters St SW Atlanta, GA",False,None,2,1265ft2
Georgia,atlanta,nat,apa,6972615796,None,BRAND NEW APARTMENTS IN CASTLE BERRY HILL!,https://atlanta.craigslist.org/nat/apa/d/atlanta-brand-new-apartments-in-castle/6972615796.html,2019-09-26,15:50,$2105,"210 Peters St SW Atlanta, GA",False,None,2,1247ft2
